{
  "schema": "omnikali.universal-goals/v1",
  "revision": 0,
  "repositories": [
    {
      "id": "1400128174",
      "fullName": "onnxscibroccoli/morphe-patches",
      "visibility": "public",
      "currentBindings": {
        "codeSha": "18ffc1f7b30219a70a4ab4f5d4d05b156b4a3fe3",
        "transportContractHash": "597382637e4a820ac8baf84967d282527d9627f73b591bbfe0e516ee391424d2"
      }
    },
    {
      "id": "1371386327",
      "fullName": "onnxscibroccoli/omnikali-link",
      "visibility": "public",
      "currentBindings": {
        "codeSha": "98d8124791eca8530756c8302e7832981386c1a3",
        "transportContractHash": "597382637e4a820ac8baf84967d282527d9627f73b591bbfe0e516ee391424d2"
      }
    },
    {
      "id": "1394231222",
      "fullName": "onnxscibroccoli/omn-kali-knowledge-graph-master",
      "visibility": "public",
      "currentBindings": {
        "codeSha": "fd5cca1d4fed96cd552e08711885e5c9617c3fde",
        "transportContractHash": "597382637e4a820ac8baf84967d282527d9627f73b591bbfe0e516ee391424d2"
      }
    },
    {
      "id": "1357276506",
      "fullName": "onnxscibroccoli/lattice-audit",
      "visibility": "public",
      "currentBindings": {
        "codeSha": "858d6d4fc5f5f34f6e3823161ef70bfb43749483",
        "transportContractHash": "597382637e4a820ac8baf84967d282527d9627f73b591bbfe0e516ee391424d2"
      }
    },
    {
      "id": "1363097521",
      "fullName": "onnxscibroccoli/half-a-mile",
      "visibility": "public",
      "currentBindings": {
        "codeSha": "9ccd14f49228f8d9ab64427b4023924cd4a9aa1c",
        "transportContractHash": "597382637e4a820ac8baf84967d282527d9627f73b591bbfe0e516ee391424d2"
      }
    },
    {
      "id": "1400152912",
      "fullName": "onnxscibroccoli/morphe-desktop",
      "visibility": "public",
      "currentBindings": {
        "codeSha": "9bc059777b21b5f33fa8323b0b364bc92222b637",
        "transportContractHash": "597382637e4a820ac8baf84967d282527d9627f73b591bbfe0e516ee391424d2"
      }
    },
    {
      "id": "1305206212",
      "fullName": "onnxscibroccoli/broccoli-core",
      "visibility": "public",
      "currentBindings": {
        "codeSha": "37bfee84ef29da016d73262b7b6f006468d101ed",
        "transportContractHash": "597382637e4a820ac8baf84967d282527d9627f73b591bbfe0e516ee391424d2"
      }
    },
    {
      "id": "1400152880",
      "fullName": "onnxscibroccoli/morphe-patches-template",
      "visibility": "public",
      "currentBindings": {
        "codeSha": "57538a3b85ccd3c9a24ed3cc06ec722787563879",
        "transportContractHash": "597382637e4a820ac8baf84967d282527d9627f73b591bbfe0e516ee391424d2"
      }
    },
    {
      "id": "1400126973",
      "fullName": "onnxscibroccoli/noVNC",
      "visibility": "public",
      "currentBindings": {
        "codeSha": "acca57b997f206683d27796829ee1f72da37002a",
        "transportContractHash": "597382637e4a820ac8baf84967d282527d9627f73b591bbfe0e516ee391424d2"
      }
    },
    {
      "id": "1400127009",
      "fullName": "onnxscibroccoli/oauth2-proxy",
      "visibility": "public",
      "currentBindings": {
        "codeSha": "bea3f04bf87b93f5354f392fe2216a88e6031350",
        "transportContractHash": "597382637e4a820ac8baf84967d282527d9627f73b591bbfe0e516ee391424d2"
      }
    },
    {
      "id": "1400126817",
      "fullName": "onnxscibroccoli/morphe-manager",
      "visibility": "public",
      "currentBindings": {
        "codeSha": "2d9e7f65af9e03370650d7840d20a47096def3be",
        "transportContractHash": "597382637e4a820ac8baf84967d282527d9627f73b591bbfe0e516ee391424d2"
      }
    },
    {
      "id": "1400128239",
      "fullName": "onnxscibroccoli/Morphe-Patches-2",
      "visibility": "public",
      "currentBindings": {
        "codeSha": "fb52a3e46a7bf6aadef9e2a648bdea2131951f39",
        "transportContractHash": "597382637e4a820ac8baf84967d282527d9627f73b591bbfe0e516ee391424d2"
      }
    },
    {
      "id": "1388355758",
      "fullName": "onnxscibroccoli/Grasshopper",
      "visibility": "public",
      "currentBindings": {
        "codeSha": "a0423ee40287506843faff9b24989a1a37217441",
        "transportContractHash": "597382637e4a820ac8baf84967d282527d9627f73b591bbfe0e516ee391424d2"
      }
    },
    {
      "id": "1370065661",
      "fullName": "onnxscibroccoli/dectalk-live",
      "visibility": "public",
      "currentBindings": {
        "codeSha": "a6c603481bf7c0ad4c469612d2cf6adefca8b2ad",
        "transportContractHash": "597382637e4a820ac8baf84967d282527d9627f73b591bbfe0e516ee391424d2"
      }
    },
    {
      "id": "1400128205",
      "fullName": "onnxscibroccoli/morphe-patches-1",
      "visibility": "public",
      "currentBindings": {
        "codeSha": "d60e85c68ab6c268b497f849000645da263c3b4d",
        "transportContractHash": "597382637e4a820ac8baf84967d282527d9627f73b591bbfe0e516ee391424d2"
      }
    },
    {
      "id": "1380712368",
      "fullName": "onnxscibroccoli/kiln",
      "visibility": "public",
      "currentBindings": {
        "codeSha": "fed47797e3cbde14fee7b0634bb688f7125f0081",
        "transportContractHash": "597382637e4a820ac8baf84967d282527d9627f73b591bbfe0e516ee391424d2"
      }
    },
    {
      "id": "1361573997",
      "fullName": "onnxscibroccoli/shizuku-silent-mic",
      "visibility": "public",
      "currentBindings": {
        "codeSha": "6fe4ad8801e6e6537e51096166812d3366a3ec8f",
        "transportContractHash": "597382637e4a820ac8baf84967d282527d9627f73b591bbfe0e516ee391424d2"
      }
    },
    {
      "id": "1363273416",
      "fullName": "onnxscibroccoli/newsroom-desk",
      "visibility": "public",
      "currentBindings": {
        "codeSha": "ebe418d02e9051eaeff95f834bedfe94d8993120",
        "transportContractHash": "597382637e4a820ac8baf84967d282527d9627f73b591bbfe0e516ee391424d2"
      }
    },
    {
      "id": "1363115269",
      "fullName": "onnxscibroccoli/onnxscibroccoli.github.io",
      "visibility": "public",
      "currentBindings": {
        "codeSha": "40de96bfd1071c5de77d31dcec386a91f65647d4",
        "transportContractHash": "597382637e4a820ac8baf84967d282527d9627f73b591bbfe0e516ee391424d2"
      }
    },
    {
      "id": "1382126784",
      "fullName": "onnxscibroccoli/helix",
      "visibility": "public",
      "currentBindings": {
        "codeSha": "3a87c196bfb100ed3eda7ad20d7ad4b93e613443",
        "transportContractHash": "597382637e4a820ac8baf84967d282527d9627f73b591bbfe0e516ee391424d2"
      }
    },
    {
      "id": "1380586130",
      "fullName": "onnxscibroccoli/omnikali",
      "visibility": "public",
      "currentBindings": {
        "codeSha": "3943b1b5dd941d8a6ef2138fec79db58b648d9fe",
        "transportContractHash": "597382637e4a820ac8baf84967d282527d9627f73b591bbfe0e516ee391424d2"
      }
    }
  ],
  "goals": [
    {
      "id": "GH-BROWSER-001",
      "title": "Operate provider browser sessions without OpenClaw",
      "requestKey": "user-20261002:GH-BROWSER-001",
      "requestedAt": "2026-10-02T17:12:58Z",
      "requestedBy": "user",
      "sourceRequestRef": "request:2026-10-02:browser-and-account-goals",
      "ownerRepositoryId": "1388355758",
      "affectedRepositories": [
        "1388355758"
      ],
      "capability": "Operate provider browser sessions without OpenClaw",
      "targetArchitecture": "Operate provider browser sessions without OpenClaw",
      "dependencies": [
        "GH-BROWSER-002",
        "GH-BROWSER-003"
      ],
      "acceptanceCriteria": [
        {
          "id": "GH-BROWSER-001:1",
          "description": "Real provider prompt and fresh assistant response without OpenClaw",
          "requiredScope": "LIVE"
        },
        {
          "id": "GH-BROWSER-001:2",
          "description": "Same contract proven with a second provider",
          "requiredScope": "LIVE"
        }
      ],
      "implementationRefs": [],
      "evidenceRefs": [],
      "status": "PLANNED",
      "blockers": [],
      "nextAction": "Implement and verify acceptance criteria",
      "revision": 0,
      "supersedes": []
    },
    {
      "id": "GH-BROWSER-002",
      "title": "Persist private provider/account profiles and reconcile uncertain submissions",
      "requestKey": "user-20261002:GH-BROWSER-002",
      "requestedAt": "2026-10-02T17:12:58Z",
      "requestedBy": "user",
      "sourceRequestRef": "request:2026-10-02:browser-and-account-goals",
      "ownerRepositoryId": "1388355758",
      "affectedRepositories": [
        "1388355758"
      ],
      "capability": "Persist private provider/account profiles and reconcile uncertain submissions",
      "targetArchitecture": "Persist private provider/account profiles and reconcile uncertain submissions",
      "dependencies": [],
      "acceptanceCriteria": [
        {
          "id": "GH-BROWSER-002:1",
          "description": "Exclusive profile lease",
          "requiredScope": "LIVE"
        },
        {
          "id": "GH-BROWSER-002:2",
          "description": "Crash after submit does not duplicate prompt",
          "requiredScope": "LIVE"
        },
        {
          "id": "GH-BROWSER-002:3",
          "description": "Unknown submission remains unknown",
          "requiredScope": "LIVE"
        }
      ],
      "implementationRefs": [],
      "evidenceRefs": [],
      "status": "PLANNED",
      "blockers": [],
      "nextAction": "Implement and verify acceptance criteria",
      "revision": 0,
      "supersedes": []
    },
    {
      "id": "GH-BROWSER-003",
      "title": "Pause and resume browser human gates with durable checkpoints",
      "requestKey": "user-20261002:GH-BROWSER-003",
      "requestedAt": "2026-10-02T17:12:58Z",
      "requestedBy": "user",
      "sourceRequestRef": "request:2026-10-02:browser-and-account-goals",
      "ownerRepositoryId": "1388355758",
      "affectedRepositories": [
        "1388355758"
      ],
      "capability": "Pause and resume browser human gates with durable checkpoints",